{
  "$schema": "http://json-schema.org/draft-07/schema#",
  "$id": "https://example.com/reviews-widget/schemas/reviews.schema.json",
  "title": "Reviews widget reviews/<year>.json",
  "type": "array",
  "minItems": 1,
  "items": {
    "type": "object",
    "required": [
      "platform",
      "platform_review_id",
      "reviewer_name",
      "reviewer_image",
      "text",
      "date"
    ],
    "additionalProperties": true,
    "properties": {
      "platform": {
        "type": "string",
        "minLength": 1
      },
      "platform_review_id": {
        "type": [
          "string",
          "number"
        ],
        "description": "Suggested identity key with platform for sync tooling (unique per platform). Not a hard layout rule."
      },
      "reviewer_name": {
        "type": [
          "string",
          "null"
        ]
      },
      "reviewer_profile_url": {
        "type": [
          "string",
          "null"
        ]
      },
      "reviewer_image": {
        "type": "string",
        "minLength": 1,
        "description": "Avatar URL or path relative to the data root. Any working URL/path is fine; images/reviewers/<platform>-<id>.<ext> is only a sync-tooling convention."
      },
      "reviewer_image_source_url": {
        "type": [
          "string",
          "null"
        ]
      },
      "rating": {
        "anyOf": [
          {
            "type": "integer",
            "minimum": 1,
            "maximum": 5
          },
          {
            "type": "null"
          }
        ]
      },
      "text": {
        "type": "string"
      },
      "date": {
        "type": "string",
        "pattern": "^\\d{4}-\\d{2}-\\d{2}T\\d{2}:\\d{2}(:\\d{2}(\\.\\d+)?)?(Z|[+-]\\d{2}:\\d{2})$"
      },
      "review_url": {
        "type": "string",
        "minLength": 1,
        "description": "Optional. When set (or platforms.*.card_link page_url resolves), the card is a link with a View on cue. When no href resolves, the card is not clickable and has no footer link text."
      },
      "owner_reply": {
        "anyOf": [
          {
            "type": "null"
          },
          {
            "type": "object",
            "required": [
              "text"
            ],
            "properties": {
              "text": {
                "type": "string"
              },
              "date": {
                "anyOf": [
                  {
                    "type": "string",
                    "pattern": "^\\d{4}-\\d{2}-\\d{2}T\\d{2}:\\d{2}(:\\d{2}(\\.\\d+)?)?(Z|[+-]\\d{2}:\\d{2})$"
                  },
                  {
                    "type": "null"
                  }
                ]
              }
            }
          }
        ]
      },
      "collected_at": {
        "type": "string",
        "pattern": "^\\d{4}-\\d{2}-\\d{2}T\\d{2}:\\d{2}(:\\d{2}(\\.\\d+)?)?(Z|[+-]\\d{2}:\\d{2})$"
      },
      "updated_at": {
        "type": "string",
        "pattern": "^\\d{4}-\\d{2}-\\d{2}T\\d{2}:\\d{2}(:\\d{2}(\\.\\d+)?)?(Z|[+-]\\d{2}:\\d{2})$"
      },
      "nofollow": {
        "type": "boolean",
        "description": "When set, overrides platforms.<key>.nofollow for this card's outbound link."
      },
      "noreferrer": {
        "type": "boolean",
        "description": "When set, overrides platforms.<key>.noreferrer for this card's outbound link."
      },
      "rel": {
        "type": "string",
        "description": "Optional space-separated rel tokens; when set (or with nofollow/noreferrer), overrides the platform for this card. noopener is always applied."
      },
      "hidden": {
        "type": "boolean",
        "description": "Optional. true keeps the review in the data but hides it: not shown, counted, averaged or included in the JSON-LD."
      },
      "excerpt": {
        "type": "string",
        "minLength": 1,
        "description": "Optional. An exact passage of text (whitespace may differ) shown on the card instead of the opening characters, with ellipses where it starts or ends mid-text. The full text stays in the data."
      }
    }
  }
}
